from,to,positive,neutral,negative
Ricky-Tigg,Ricky-Tigg,[],"[{'message': ""### Describe the Feature\n\nHello. The program acquired from this repository and installed works as intended. Nonetheless I'd rather keep the benefit of having a release installed as packaged by the Linux distribution I am using in order to obtain its automatic updates. However, the uninstallation is uncovered in the`INSTALL.generic` file. This could be rectified by an addition either of a methodology into this file or script dedicated for that purpose.\n\n### Expected Complications\n\n_No response_\n\n### Will I try to implement this new feature?\n\nYes"", 'score': -0.1324781384319067, 'timestamp': '2023-11-16T12:28:18Z', 'file_name': 'issue_72.csv'}, {'message': '### Describe the bug\n\n_Reference:_ _INSTALL.generic_ | `./configure` is present as a configuration instruction.\n\nHello, In Bash Shell:\n```\n$ ./configure\nbash: ./configure: No such file or directory\n$ ls | grep -i configure\nconfigure.ac\n```\n\n### Version\n\n5.4.5; as source code (tar.gz)\n\n### Operating System\n\nFedora; edition 39\n\n### Relevant log output\n\n_No response_', 'score': -0.041392624378204346, 'timestamp': '2023-11-15T16:21:13Z', 'file_name': 'issue_71.csv'}]",[]
mgood7123,mgood7123,[],"[{'message': 'how stable is cmake support in xz ?\n\nas i plan to build for windows via cmake and add xz as a library in my project', 'score': 0.17353841802105308, 'timestamp': '2023-10-31T15:42:14Z', 'file_name': 'issue_68.csv'}]","[{'message': '### Describe the bug\n\n```\nlocalhost:~/llvm_18$ release_BUILD/LIBXZ/OUT/bin/lzma\nError relocating release_BUILD/LIBXZ/BUILD/lzma: unsupported relocation type 37\nError relocating release_BUILD/LIBXZ/BUILD/lzma: unsupported relocation type 37\n```\n\n```cmake\nif (NOT EXISTS ${CMAKE_BINARY_DIR}/LIBXZ)\n  execute_process(\n    COMMAND ${CMAKE_COMMAND} -E copy_directory ${CMAKE_CURRENT_SOURCE_DIR}/xz ${CMAKE_BINARY_DIR}/LIBXZ\n  )\nendif()\n\nif (NOT EXISTS ${CMAKE_BINARY_DIR}/LIBXZ/OUT/lib/liblzma.a)\n  execute_process(\n    COMMAND\n      ${CMAKE_COMMAND}\n      -D CMAKE_BUILD_TYPE=Release\n      -D ""CMAKE_C_FLAGS=${CMAKE_C_FLAGS}""\n      -D ""CMAKE_CXX_FLAGS=${CMAKE_CXX_FLAGS}""\n      -D CMAKE_C_COMPILER=${CMAKE_C_COMPILER}\n      -D CMAKE_CXX_COMPILER=${CMAKE_CXX_COMPILER}\n      -D CMAKE_INSTALL_PREFIX:PATH=${CMAKE_BINARY_DIR}/LIBXZ/OUT\n      -D BUILD_SHARED_LIBS=OFF\n      -B ${CMAKE_BINARY_DIR}/LIBXZ/BUILD\n    WORKING_DIRECTORY ${CMAKE_BINARY_DIR}/LIBXZ\n    COMMAND_ECHO STDOUT\n  )\n  execute_process(\n    COMMAND\n      ${CMAKE_COMMAND}\n      --build ${CMAKE_BINARY_DIR}/LIBXZ/BUILD\n    WORKING_DIRECTORY ${CMAKE_BINARY_DIR}/LIBXZ\n    COMMAND_ECHO STDOUT\n  )\n  execute_process(\n    COMMAND\n      ${CMAKE_COMMAND}\n      --install ${CMAKE_BINARY_DIR}/LIBXZ/BUILD\n    WORKING_DIRECTORY ${CMAKE_BINARY_DIR}/LIBXZ\n    COMMAND_ECHO STDOUT\n  )\nendif()\n```\n\n### Version\n\n5.5.0 git master https://github.com/tukaani-project/xz/commit/837ea40b1c9d4998cac4500b55171bf33e0c31a6\n\n### Operating System\n\nalpine linux\n\n### Relevant log output\n\n_No response_', 'score': -0.37372049083933234, 'timestamp': '2023-11-15T02:17:34Z', 'file_name': 'issue_70.csv'}, {'message': 'so this is caused by musl not supporting `_ifunc_` attribute and current alpine linux clang compilers (clang 14, 15, 16, and 17 to 17.0.3) not emitting a warning if `ifunc` is used for a musl target, (unlike gcc which does emit a warning)\n\nfixable via `-D ALLOW_ATTR_IFUNC=OFF`', 'score': -0.7689193869009614, 'timestamp': '2023-11-15T03:42:52Z', 'file_name': 'issue_70.csv'}]"
XVilka,XVilka,[],"[{'message': ""### Describe the bug\n\nWe compile xz as a Meson subproject. We have AppVeyor VS2019 as CI job, they recently updated their toolchain to LLVM/Clang 16.0.1, we use `clang-cl` to compile everything. After the upgrade, it started producing this error:\n```\n..\\subprojects\\xz-5.4.1\\src\\common\\tuklib_integer.h(647,2): error: call to undeclared library function '_BitScanReverse' with type 'unsigned char (unsigned long *, unsigned long)'; ISO C99 and later do not support implicit function declarations [-Wimplicit-function-declaration]\n        _BitScanReverse(&i, n);\n        ^\n..\\subprojects\\xz-5.4.1\\src\\common\\tuklib_integer.h(647,2): note: include the header <intrin.h> or explicitly provide a declaration for '_BitScanReverse'\n..\\subprojects\\xz-5.4.1\\src\\common\\tuklib_integer.h(749,2): error: call to undeclared library function '_BitScanForward' with type 'unsigned char (unsigned long *, unsigned long)'; ISO C99 and later do not support implicit function declarations [-Wimplicit-function-declaration]\n        _BitScanForward(&i, n);\n        ^\n```\nSee full log here:\nhttps://ci.appveyor.com/project/rizinorg/rizin/builds/46815593/job/ny9b339jydox5pft#L5611\n\nThis is the wrap file we use: https://github.com/rizinorg/rizin/blob/dev/subprojects/liblzma.wrap\nThese are Meson build files: https://github.com/rizinorg/rizin/tree/dev/subprojects/packagefiles/xz-5.4.1\n\n### Version\n\n5.4.1\n\n### Operating System\n\nWindows Server 2019 (AppVeyor VS2019 image)\n\n### Relevant log output\n\n_No response_"", 'score': -0.1844292115420103, 'timestamp': '2023-04-19T02:25:47Z', 'file_name': 'issue_48.csv'}]",[]
TheStoryEnd,TheStoryEnd,[],[],"[{'message': 'https://nvd.nist.gov/vuln/detail/CVE-2020-22916\n\nThis link seems to be inaccessiblehttps://github.com/snappyJack/CVE-request-XZ-5.2.5-has-denial-of-service-vulnerability\n\nIs there a fix for CVE xz?\n[1] If not, what is the repair plan for xz?\n[2] If yes, can you indicate which submissions fix CVE-2020-22916?\n\n', 'score': -0.7740593953058124, 'timestamp': '2023-08-29T08:45:10Z', 'file_name': 'issue_61.csv'}]"
rubyFeedback,rubyFeedback,[],"[{'message': ""### Describe the bug\n\n    make  all-recursive\n    make[1]: Entering directory '/Depot/jjj/xz-5.6.0'\n    Making all in src\n    make[2]: Entering directory '/Depot/jjj/xz-5.6.0/src'\n    Making all in liblzma\n    make[3]: Entering directory '/Depot/jjj/xz-5.6.0/src/liblzma'\n    Making all in api\n    make[4]: Entering directory '/Depot/jjj/xz-5.6.0/src/liblzma/api'\n    make[4]: Nothing to be done for 'all'.\n    make[4]: Leaving directory '/Depot/jjj/xz-5.6.0/src/liblzma/api'\n    make[4]: Entering directory '/Depot/jjj/xz-5.6.0/src/liblzma'\n    make[4]: Nothing to be done for 'all-am'.\n    make[4]: Leaving directory '/Depot/jjj/xz-5.6.0/src/liblzma'\n    make[3]: Leaving directory '/Depot/jjj/xz-5.6.0/src/liblzma'\n    Making all in xzdec\n    make[3]: Entering directory '/Depot/jjj/xz-5.6.0/src/xzdec'\n    gcc -DHAVE_CONFIG_H -I. -I../..  -DTUKLIB_GETTEXT=0 -I../../src/common -I../../src/liblzma/api -I../../lib  -pthread -fvisibility=hidden -Wall -Wextra -Wvla -Wformat=2 -Winit-self -Wmissing-include-dirs -Wshift-overflow=2 -Wstrict-overflow=3 -Walloc-zero -Wduplicated-cond -Wfloat-equal -Wundef -Wshadow -Wpointer-arith -Wbad-function-cast -Wwrite-strings -Wdate-time -Wsign-conversion -Wfloat-conversion -Wlogical-op -Waggregate-return -Wstrict-prototypes -Wold-style-definition -Wmissing-prototypes -Wmissing-declarations -Wredundant-decls -O2 -fPIC -fno-strict-overflow -Wno-error -MT xzdec-xzdec.o -MD -MP -MF .deps/xzdec-xzdec.Tpo -c -o xzdec-xzdec.o `test -f 'xzdec.c'     || echo './'`xzdec.c\n    xzdec.c: In function sandbox_enter:\n    xzdec.c:329:36: error: SYS_landlock_create_ruleset undeclared (first use in this function)\n      329 |         int landlock_abi = syscall(SYS_landlock_create_ruleset,\n          |                                    ^~~~~~~~~~~~~~~~~~~~~~~~~~~\n    xzdec.c:329:36: note: each undeclared identifier is reported only once for each function it appears in\n    xzdec.c:349:29: error: SYS_landlock_restrict_self undeclared (first use in this function)\n      349 |                 if (syscall(SYS_landlock_restrict_self, ruleset_fd, 0U) != 0)\n          |                             ^~~~~~~~~~~~~~~~~~~~~~~~~~\n    make[3]: *** [Makefile:606: xzdec-xzdec.o] Error 1\n    make[3]: Leaving directory '/Depot/jjj/xz-5.6.0/src/xzdec'\n    make[2]: *** [Makefile:427: all-recursive] Error 1\n    make[2]: Leaving directory '/Depot/jjj/xz-5.6.0/src'\n    make[1]: *** [Makefile:597: all-recursive] Error 1\n    make[1]: Leaving directory '/Depot/jjj/xz-5.6.0'\n    make: *** [Makefile:487: all] Error 2\n\n\nI can compile older xz releases fine by the way, on the same system, so 5.4.x, \n5.2.x. Not sure what changed.\n\nMy system is a custom built slackware; I recompiled most\nthings from source following mostly LFS/BLFS instructions.\nxz 5.6.x is not yet appearing on LFS, so I just poke in the\ndark here really.\n\nglibc is 2.33, gcc is 11.4.0.\n\n### Version\n\n5.6.0\n\n### Operating System\n\nlinux\n\n### Relevant log output\n\n_No response_"", 'score': 0.004631919786334038, 'timestamp': '2024-02-25T14:44:02Z', 'file_name': 'issue_88.csv'}]",[]
asarubbo,asarubbo,"[{'message': 'As a side note, with -M 30000000000 (30GB) I can run until 22 threads without issues.\n\nWith -M 90000000000 (90GB) I can run it with 64 threads without issues.', 'score': 0.21578024653717875, 'timestamp': '2024-02-27T15:21:52Z', 'file_name': 'issue_89.csv'}]",[],"[{'message': ""### Describe the bug\n\nOur [Gentoo Tinderbox](https://blogs.gentoo.org/ago/2020/07/04/gentoo-tinderbox/) reported a test failure at [bug 914170](https://bugs.gentoo.org/914170)\n\nBy looking at test-suite.log I can see:\n\n```\n==1161==ERROR: AddressSanitizer: global-buffer-overflow on address 0x5614ecd418a0 at pc 0x7f8d20216905 bp 0x7ffd6a482040 sp 0x7ffd6a482038\nREAD of size 16 at 0x5614ecd418a0 thread T0\n    #0 0x7f8d20216904 in crc64_clmul /var/tmp/portage/app-arch/xz-utils-5.4.4/work/xz-5.4.4/src/liblzma/check/crc64_fast.c:284:40\n    #1 0x5614ecd2a53c in test_lzma_crc64 /var/tmp/portage/app-arch/xz-utils-5.4.4/work/xz-5.4.4/tests/test_check.c:106:2\n    #2 0x5614ecd2a237 in tuktest_run_test /var/tmp/portage/app-arch/xz-utils-5.4.4/work/xz-5.4.4/tests/tuktest.h:596:4\n    #3 0x5614ecd29cec in main /var/tmp/portage/app-arch/xz-utils-5.4.4/work/xz-5.4.4/tests/test_check.c:383:2\n    #4 0x7f8d1fe23c89  (/lib64/libc.so.6+0x23c89)\n    #5 0x7f8d1fe23d44 in __libc_start_main (/lib64/libc.so.6+0x23d44)\n    #6 0x5614ecc553f0 in _start (/var/tmp/portage/app-arch/xz-utils-5.4.4/work/xz-5.4.4-abi_x86_64.amd64/tests/.libs/test_check+0x203f0)\n\n0x5614ecd418a0 is located 32 bytes before global variable '.str.42' defined in '/var/tmp/portage/app-arch/xz-utils-5.4.4/work/xz-5.4.4/tests/test_check.c:78' (0x5614ecd418c0) of size 51\n  '.str.42' is ascii string 'assert_uint: '%s == %lu' but expected '... %s %lu''\n0x5614ecd418a9 is located 0 bytes after global variable 'test_string' defined in '/var/tmp/portage/app-arch/xz-utils-5.4.4/work/xz-5.4.4/tests/test_check.c:22' (0x5614ecd418a0) of size 9\nSUMMARY: AddressSanitizer: global-buffer-overflow /var/tmp/portage/app-arch/xz-utils-5.4.4/work/xz-5.4.4/src/liblzma/check/crc64_fast.c:284:40 in crc64_clmul\nShadow bytes around the buggy address:\n  0x5614ecd41600: 07 f9 f9 f9 f9 f9 f9 f9 00 00 00 05 f9 f9 f9 f9\n  0x5614ecd41680: 00 00 00 03 f9 f9 f9 f9 00 00 00 00 00 00 00 04\n  0x5614ecd41700: f9 f9 f9 f9 06 f9 f9 f9 06 f9 f9 f9 07 f9 f9 f9\n  0x5614ecd41780: 00 07 f9 f9 00 04 f9 f9 00 02 f9 f9 00 00 00 00\n  0x5614ecd41800: 00 06 f9 f9 f9 f9 f9 f9 00 00 00 00 00 02 f9 f9\n=>0x5614ecd41880: f9 f9 f9 f9[00]01 f9 f9 00 00 00 00 00 00 03 f9\n  0x5614ecd41900: f9 f9 f9 f9 00 00 00 00 00 00 f9 f9 f9 f9 f9 f9\n  0x5614ecd41980: 03 f9 f9 f9 00 04 f9 f9 00 00 00 00 00 00 07 f9\n  0x5614ecd41a00: f9 f9 f9 f9 04 f9 f9 f9 00 00 00 02 f9 f9 f9 f9\n  0x5614ecd41a80: 00 00 00 00 00 00 f9 f9 f9 f9 f9 f9 00 00 00 00\n  0x5614ecd41b00: 00 00 07 f9 f9 f9 f9 f9 00 00 00 03 f9 f9 f9 f9\nShadow byte legend (one shadow byte represents 8 application bytes):\n  Addressable:           00\n  Partially addressable: 01 02 03 04 05 06 07 \n  Heap left redzone:       fa\n  Freed heap region:       fd\n  Stack left redzone:      f1\n  Stack mid redzone:       f2\n  Stack right redzone:     f3\n  Stack after return:      f5\n  Stack use after scope:   f8\n  Global redzone:          f9\n  Global init order:       f6\n  Poisoned by user:        f7\n  Container overflow:      fc\n  Array cookie:            ac\n  Intra object redzone:    bb\n  ASan internal:           fe\n  Left alloca redzone:     ca\n  Right alloca redzone:    cb\n==1161==ABORTING\n```\n\nI didn't look deeply into this issue so I don't know if the bug is in the unittest itself or in the involed libraries/daemons, if so please check for any security implications. I'm not doing a private report since it is already public on gentoo bugzilla.\nIf I can do further, please let me know.\n\n### Version\n\n5.4.4\n\n### Operating System\n\nGentoo\n\n### Relevant log output\n\n_No response_"", 'score': -0.2796298465691507, 'timestamp': '2023-09-14T07:48:04Z', 'file_name': 'issue_62.csv'}, {'message': '### Describe the bug\n\nSince few days I updated to 5.6.0.\n\nWhen I try to compress text I always get:\n\n```\nxz: Reduced the number of threads from 64 to X to not exceed the memory usage limit of .. MiB\n```\n\nSo to use threads I increased the memory limit around 3GB but still I get the message.\n\nAs a POC I did:\n```\necho ""a"" > file\nfor i in {1..64} ; do echo $i ; xz -k -f -z -9 -T $i -M 3000000000 file ; done\n```\nAnd I discovered that with `i=3` it reduces threads from `i` to 2\n\n`xz -H` says that `-M` accepts the LIMIT in bytes, so 3000000000 are 3GB of ram.\n\nIs there anything wrong with it or how much ram I\'m supposing to give to the process? \n\n\n\n\n### Version\n\n5.6.0\n\n### Operating System\n\nGentoo Linux\n\n### Relevant log output\n\n_No response_', 'score': -0.29440486151725054, 'timestamp': '2024-02-27T15:16:41Z', 'file_name': 'issue_89.csv'}]"
satmandu,satmandu,"[{'message': '(Older versions build just fine.)', 'score': 0.8566675940528512, 'timestamp': '2024-02-24T16:35:21Z', 'file_name': 'issue_84.csv'}, {'message': 'Building with `cmake` and `-DENABLE_SANDBOX=OFF` solved this problem for us.', 'score': 0.38842182513326406, 'timestamp': '2024-02-25T02:52:43Z', 'file_name': 'issue_84.csv'}]",[],"[{'message': ""### Describe the bug\n\nFails to build on armv7l. built with `--enable-shared`\n\n\n### Version\n\n5.6.0\n\n### Operating System\n\nChromeOS, M91\n\n### Relevant log output\n\n```shell\nmake  all-recursive\nmake[1]: Entering directory '/usr/local/tmp/crew/xzutils.20240224160935.dir/xz-5.6.0'\nMaking all in src\nmake[2]: Entering directory '/usr/local/tmp/crew/xzutils.20240224160935.dir/xz-5.6.0/src'\nMaking all in liblzma\nmake[3]: Entering directory '/usr/local/tmp/crew/xzutils.20240224160935.dir/xz-5.6.0/src/liblzma'\nMaking all in api\nmake[4]: Entering directory '/usr/local/tmp/crew/xzutils.20240224160935.dir/xz-5.6.0/src/liblzma/api'\nmake[4]: Nothing to be done for 'all'.\nmake[4]: Leaving directory '/usr/local/tmp/crew/xzutils.20240224160935.dir/xz-5.6.0/src/liblzma/api'\nmake[4]: Entering directory '/usr/local/tmp/crew/xzutils.20240224160935.dir/xz-5.6.0/src/liblzma'\nmake[4]: Nothing to be done for 'all-am'.\nmake[4]: Leaving directory '/usr/local/tmp/crew/xzutils.20240224160935.dir/xz-5.6.0/src/liblzma'\nmake[3]: Leaving directory '/usr/local/tmp/crew/xzutils.20240224160935.dir/xz-5.6.0/src/liblzma'\nMaking all in xzdec\nmake[3]: Entering directory '/usr/local/tmp/crew/xzutils.20240224160935.dir/xz-5.6.0/src/xzdec'\narmv7l-cros-linux-gnueabihf-gcc -DHAVE_CONFIG_H -I. -I../..  -DTUKLIB_GETTEXT=0 -I../../src/common -I../../src/liblzma/api -I../../lib  -pthread -fvisibility=hidden -Wall -Wextra -Wvla -Wformat=2 -Winit-self -Wmissing-include-dirs -Wshift-overflow=2 -Wstrict-overflow=3 -Walloc-zero -Wduplicated-cond -Wfloat-equal -Wundef -Wshadow -Wpointer-arith -Wbad-function-cast -Wwrite-strings -Wdate-time -Wsign-conversion -Wfloat-conversion -Wlogical-op -Waggregate-return -Wstrict-prototypes -Wold-style-definition -Wmissing-prototypes -Wmissing-declarations -Wredundant-decls -O2 -pipe -ffat-lto-objects -fPIC -mfloat-abi=hard -mthumb -mfpu=vfpv3-d16 -march=armv7-a+fp -fuse-ld=mold  -flto=auto -c -o xzdec-xzdec.o `test -f 'xzdec.c' || echo './'`xzdec.c\nxzdec.c: In function sandbox_enter:\nxzdec.c:329:36: error: SYS_landlock_create_ruleset undeclared (first use in this function)\n  329 |         int landlock_abi = syscall(SYS_landlock_create_ruleset,\n      |                                    ^~~~~~~~~~~~~~~~~~~~~~~~~~~\nxzdec.c:329:36: note: each undeclared identifier is reported only once for each function it appears in\nxzdec.c:349:29: error: SYS_landlock_restrict_self undeclared (first use in this function)\n  349 |                 if (syscall(SYS_landlock_restrict_self, ruleset_fd, 0U) != 0)\n      |                             ^~~~~~~~~~~~~~~~~~~~~~~~~~\nmake[3]: *** [Makefile:610: xzdec-xzdec.o] Error 1\nmake[3]: Leaving directory '/usr/local/tmp/crew/xzutils.20240224160935.dir/xz-5.6.0/src/xzdec'\nmake[2]: *** [Makefile:427: all-recursive] Error 1\nmake[2]: Leaving directory '/usr/local/tmp/crew/xzutils.20240224160935.dir/xz-5.6.0/src'\nmake[1]: *** [Makefile:597: all-recursive] Error 1\nmake[1]: Leaving directory '/usr/local/tmp/crew/xzutils.20240224160935.dir/xz-5.6.0'\nmake: *** [Makefile:487: all] Error 2\nThere was a build error.\n```"", 'score': -0.5890067126601934, 'timestamp': '2024-02-24T16:21:05Z', 'file_name': 'issue_84.csv'}]"
milkylainen,milkylainen,[],"[{'message': ""Well. Not really a bug, but perhaps more a question of default and helpful information.\nPlease correct me if I'm wrong here.\nI've always lived with the assumption that using xz with more than one thread isn't deterministic.\nIe, the compression result will vary with threads?\nBy changing the default, various usages will start to perhaps experience different results when building on different machines.\nLike packagers, embedded build envs etc.\n\nHas anything changed in the determinism department or can users just expect that default is to create variable results with the defaults?\n\n### Version\n\n5.6\n\n### Operating System\n\nLinux\n\n### Relevant log output\n\n_No response_"", 'score': 0.0053563714027404785, 'timestamp': '2024-02-24T16:59:20Z', 'file_name': 'issue_85.csv'}]",[]
snweiss,snweiss,[],"[{'message': ""### Describe the bug\n\nTrying to install xz_utils via conan - \n```\nxz_utils/5.4.2: Sources downloaded from 'conancenter'\nxz_utils/5.4.2: Calling source() in C:\\Users\\ContainerAdministrator\\.conan2\\p\\xz_ut55e9abba365d4\\s\\src\nxz_utils/5.4.2: ERROR: Error downloading file https://tukaani.org/xz/xz-5.4.2.tar.gz: 'HTTPSConnectionPool(host='tukaani.org', port=443): Read timed out. (read timeout=60)'\n```\n\nSeems like https://tukaani.org is down for the past week\n\n### Version\n\n5.4.2\n\n### Operating System\n\nWindows 11\n\n### Relevant log output\n\n_No response_"", 'score': -0.06816666293889284, 'timestamp': '2024-01-14T12:50:23Z', 'file_name': 'issue_78.csv'}]",[]
eworm-de,eworm-de,[],[],"[{'message': ""### Describe the bug\n\nBuilding the multilib package for Arch Linux (https://archlinux.org/packages/multilib/x86_64/lib32-xz/) fails. The lines producing the error did not change recently, but the version before (5.4.1) built without problems (and still builds with current toolchain).\n\n### Version\n\nlatest\n\n### Operating System\n\nArch Linux\n\n### Relevant log output\n\n```shell\nIn file included from lz/lz_encoder_mf.c:16:\n../../src/liblzma/common/memcmplen.h: In function 'lzma_memcmplen':\n../../src/liblzma/common/memcmplen.h:92:36: error: conversion to 'uint32_t' {aka 'const unsigned int'} from 'int' may change the sign of the result [-Werror=sign-conversion]\n   92 |                 const uint32_t x = 0xFFFF ^ _mm_movemask_epi8(_mm_cmpeq_epi8(\n      |                                    ^~~~~~\n```"", 'score': -0.6327807665802538, 'timestamp': '2023-03-19T20:13:19Z', 'file_name': 'issue_44.csv'}]"
ssvb,ssvb,"[{'message': ""### Describe the Feature\n\nSimilar to BCJ filters for executables, UTF-8 text compression can be also potentially improved by applying a filter before compressing data with LZMA. Each Cyrillic letter needs 2 bytes in UTF-8 format. And it's easy to demonstrate that converting UTF-8 to legacy 8-bit encoding improves compression. Some examples are below.\n\nUkrainian text is **~7%** better compressible in a 8-bit cp1124 encoding:\n```\nwget https://archive.org/stream/ukrainskakuhnya1998/ukrainskakuhnya1998_djvu.txt\niconv -f utf-8 -t CP1124//TRANSLIT ukrainskakuhnya1998_djvu.txt > ukrainskakuhnya1998_djvu.txt.cp1124\nxz -k ukrainskakuhnya1998_djvu.txt\nxz -k ukrainskakuhnya1998_djvu.txt.cp1124\nls -l ukrainskakuhnya1998_djvu*\n-rw-r--r-- 1 ssvb ssvb 2860770 May 15 19:44 ukrainskakuhnya1998_djvu.txt\n-rw-r--r-- 1 ssvb ssvb 1682011 May 15 19:47 ukrainskakuhnya1998_djvu.txt.cp1124\n-rw-r--r-- 1 ssvb ssvb  418940 May 15 19:47 ukrainskakuhnya1998_djvu.txt.cp1124.xz\n-rw-r--r-- 1 ssvb ssvb  448944 May 15 19:44 ukrainskakuhnya1998_djvu.txt.xz\n```\n\nFinnish text is **~0.8%** better compressible in a 8-bit latin1 encoding:\n```\nwget https://www.gutenberg.org/cache/epub/70694/pg70694.html\niconv -f utf-8 -t latin1//TRANSLIT pg70694.html > pg70694.html.latin1\nxz -k pg70694.html\nxz -k pg70694.html.latin1\nls -l pg70694*\n-rw-r--r-- 1 ssvb ssvb 742324 May  4 03:00 pg70694.html\n-rw-r--r-- 1 ssvb ssvb 709415 May 15 19:16 pg70694.html.latin1\n-rw-r--r-- 1 ssvb ssvb 223924 May 15 19:16 pg70694.html.latin1.xz\n-rw-r--r-- 1 ssvb ssvb 225720 May  4 03:00 pg70694.html.xz\n```\n\nNow regarding the filter itself. It needs to be perfectly reversible without any possible data loss during conversion. So I would suggest to use a small set of legacy 8-bit codepages, such as latin1, cp1124, cp1251 and so on. But still reserve one special character for escape sequences (to switch between the available 8-bit codepages or for injecting arbitrary binary data). I can implement a prototype of such filter if anyone is interested. But the main question is how to integrate it into XZ? And whether such filter would be accepted in principle?\n\n### Expected Complications\n\nThat's a format extension. So older releases of `xz-utils` won't be able to decompress newly created `xz` files with this new filter.\n\n### Will I try to implement this new feature?\n\nYes"", 'score': 0.7976265086326748, 'timestamp': '2023-05-15T17:21:07Z', 'file_name': 'issue_50.csv'}]",[],[]
vfazio,vfazio,[],"[{'message': 'rebased and pushed a whitespace change.', 'score': -0.002930321730673313, 'timestamp': '2023-02-08T13:32:32Z', 'file_name': 'pr_32.csv'}]","[{'message': ""On Microblaze builds will fail when trying to add symver information because  `__attribute__((symver ..))` is not supported even though `__has_attribute(__symver__)` returns true.\n\nSupport for symver needs to be detected via a compile test since `__has_attribute` can report false positives [0].\n\nAdd a configure compile check for `__attribute__((symver ..))` to ensure it is supported and define a variable to advertise support.\n\n[0] https://gcc.gnu.org/bugzilla/show_bug.cgi?id=101766#c1\n\n## Pull request checklist\n\nPlease check if your PR fulfills the following requirements:\n- [ ] Tests for the changes have been added (for bug fixes / features)\n- [ ] Docs have been reviewed and added / updated if needed (for bug fixes / features)\n- [ ] Build was run locally and without warnings or errors\n- [ ] All previous and new tests pass\n\n\n## Pull request type\n\n<!-- Please try to limit your pull request to one type, submit multiple\npull requests if needed. --> \n\nPlease check the type of change your PR introduces:\n- [x] Bugfix\n- [ ] Feature\n- [ ] Code style update (formatting, renaming, typo fix)\n- [ ] Refactoring (no functional changes, no api changes)\n- [ ] Build related changes\n- [ ] Documentation content changes\n- [ ] Other (please describe): \n\n\n## What is the current behavior?\n<!-- Please describe the current behavior that you are modifying. -->\nbuilds targeting the microblaze fail\n\n<!-- Related issue this PR addresses, if applicable -->\nRelated Issue URL: \n\n\n## What is the new behavior?\n<!-- Please describe the behavior or changes that are being added by this\nPR. -->\n\n- Builds now succeed\n\n## Does this introduce a breaking change?\n\n- [ ] Yes\n- [x] No\n\n<!-- If this introduces a breaking change, please describe the impact and\nmigration path for existing applications below. -->\n\n\n## Other information\n\nI tested compiles via GCC 12 and 9 for x86_64 and microblaze targets and didn't encounter issues.\n\n<!-- Any other information that is important to this PR. -->"", 'score': -0.916927041253075, 'timestamp': '2023-02-07T16:47:02Z', 'file_name': 'pr_32.csv'}]"
Larhzu,Larhzu,"[{'message': 'Thank you to everyone for the discussion and feedback! The core parts of the XZ Utils master branch are now under 0BSD as is the 5.5.2beta release. Assuming that people are fine with it in XZ Utils, similar change will be done later in XZ for Java and XZ Embedded.', 'score': 0.9301559195155278, 'timestamp': '2024-02-14T18:46:18Z', 'file_name': 'issue_79.csv'}]",[],[]
