from,to,positive,neutral,negative
mvatsyk-lsg,mvatsyk-lsg,[],"[{'message': '## Pull request checklist\n\nPlease check if your PR fulfills the following requirements:\n- [x] Tests for the changes have been added (for bug fixes / features)\n- [x] Docs have been reviewed and added / updated if needed (for bug fixes / features)\n- [ ] Build was run locally and without warnings or errors\n- [ ] All previous and new tests pass\n\n\n## Pull request type\n\n<!-- Please try to limit your pull request to one type, submit multiple\npull requests if needed. --> \n\nPlease check the type of change your PR introduces:\n- [ ] Bugfix\n- [x] Feature\n- [ ] Code style update (formatting, renaming, typo fix)\n- [ ] Refactoring (no functional changes, no api changes)\n- [ ] Build related changes\n- [ ] Documentation content changes\n- [ ] Other (please describe): \n\n\n## What is the current behavior?\n<!-- Please describe the current behavior that you are modifying. -->\n\n\n<!-- Related issue this PR addresses, if applicable -->\nRelated Issue URL: N/A\n\n\n## What is the new behavior?\n<!-- Please describe the behavior or changes that are being added by this\nPR. -->\n\n- Total number of fuzzers increased from 1 to 12\n- 6 new fuzzers for decompressing supported archive types\n- 5 new fuzzers for compressing data into supported archive types\n- Added LZMA Raw test files based on the existing `.lzma` ones\n\n## Does this introduce a breaking change?\n\n- [x] Yes\n- [ ] No\n\n<!-- If this introduces a breaking change, please describe the impact and\nmigration path for existing applications below. -->\nThis pull request will temporarily break existing oss-fuzz setup until the `oss-fuzz` repo accepts [a corresponding pull request](https://github.com/google/oss-fuzz/pull/11279) with the updated fuzzer configuration on their side.\n\n## Other information\n\n<!-- Any other information that is important to this PR. -->\nThe improvements to the fuzzing setup were made as a part of Google ISE project.', 'score': -0.002174755558371544, 'timestamp': '2023-11-28T12:06:38Z', 'file_name': 'pr_73.csv'}]",[]
gabibguti,gabibguti,"[{'message': ""### Describe the Feature\n\nRestrict access in your workflow jobs to your repository. This is preventive action to keep your workflows safe. The `ci.yml` workflow jobs need just minimum permissions `contents: read`, and the default GitHub permissions are higher.\n\nThis is considered good-practice and is recommended by [GitHub](https://docs.github.com/en/actions/security-guides/automatic-token-authentication) itself and other security tools, such as [Scorecards](https://docs.github.com/en/actions/security-guides/automatic-token-authentication) and [StepSecurity](https://docs.github.com/en/actions/security-guides/automatic-token-authentication).\n\n##### Additional Context\nI'm Gabriela and I work on behalf of Google and the OpenSSF suggesting supply-chain security changes :)\n\n### Expected Complications\n\nNo.\n\n### Will I try to implement this new feature?\n\nYes"", 'score': 0.39494055742397904, 'timestamp': '2023-02-22T17:44:58Z', 'file_name': 'issue_38.csv'}, {'message': ""I see you also have GitHub's Security Advisories feature enabled. So we could put 2 reporting options in the Security Policy, email and the [security advisory report link](https://github.com/tukaani-project/xz/security/advisories/new). Does it make sense?"", 'score': 0.21809934196062386, 'timestamp': '2023-04-05T17:15:35Z', 'file_name': 'pr_47.csv'}]","[{'message': '## Pull request checklist\n\nPlease check if your PR fulfills the following requirements:\n- [ ] Tests for the changes have been added (for bug fixes / features)\n- [ ] Docs have been reviewed and added / updated if needed (for bug fixes / features)\n- [ ] Build was run locally and without warnings or errors\n- [ ] All previous and new tests pass\n\n\n## Pull request type\n\n<!-- Please try to limit your pull request to one type, submit multiple\npull requests if needed. --> \n\nPlease check the type of change your PR introduces:\n- [ ] Bugfix\n- [x] Feature\n- [ ] Code style update (formatting, renaming, typo fix)\n- [ ] Refactoring (no functional changes, no api changes)\n- [ ] Build related changes\n- [ ] Documentation content changes\n- [ ] Other (please describe): \n\n\n## What is the current behavior?\nReferencing actions by major tag (e.g. `v3`)\n\n\n<!-- Related issue this PR addresses, if applicable -->\nRelated Issue URL: https://github.com/tukaani-project/xz/issues/65\nResolves https://github.com/tukaani-project/xz/issues/65\n\n## What is the new behavior?\n<!-- Please describe the behavior or changes that are being added by this\nPR. -->\nReferencing actions by commit SHA (e.g. `8ade135a41bc03ea155e62e844d188df1ea18608`)\n\n## Does this introduce a breaking change?\n\n- [ ] Yes\n- [x] No\n\n<!-- If this introduces a breaking change, please describe the impact and\nmigration path for existing applications below. -->\n\n\n## Other information\n\n<!-- Any other information that is important to this PR. -->', 'score': -0.0019700713455677032, 'timestamp': '2023-10-12T12:35:31Z', 'file_name': 'pr_67.csv'}, {'message': '## Pull request checklist\n\nPlease check if your PR fulfills the following requirements:\n- [ ] Tests for the changes have been added (for bug fixes / features)\n- [ ] Docs have been reviewed and added / updated if needed (for bug fixes / features)\n- [ ] Build was run locally and without warnings or errors\n- [ ] All previous and new tests pass\n\n## Pull request type\n\n<!-- Please try to limit your pull request to one type, submit multiple\npull requests if needed. --> \n\nPlease check the type of change your PR introduces:\n- [ ] Bugfix\n- [ ] Feature\n- [ ] Code style update (formatting, renaming, typo fix)\n- [x] Refactoring (no functional changes, no api changes)\n- [ ] Build related changes\n- [ ] Documentation content changes\n- [ ] Other (please describe): \n\n\n## What is the current behavior?\n<!-- Please describe the current behavior that you are modifying. -->\nReferencing actions by major tag (e.g. `v3`)\n\n<!-- Related issue this PR addresses, if applicable -->\nRelated Issue URL: https://github.com/tukaani-project/xz/issues/65\n\n\n## What is the new behavior?\n<!-- Please describe the behavior or changes that are being added by this\nPR. -->\n\nReferencing actions by commit SHA (e.g. `8ade135a41bc03ea155e62e844d188df1ea18608`)\n\n## Does this introduce a breaking change?\n\n- [ ] Yes\n- [x] No\n\n<!-- If this introduces a breaking change, please describe the impact and\nmigration path for existing applications below. -->\n\n\n## Other information\n\n<!-- Any other information that is important to this PR. -->', 'score': -0.0019700713455677032, 'timestamp': '2023-09-26T16:35:37Z', 'file_name': 'pr_66.csv'}, {'message': 'An idea to fix `windows-ci`: I can add a trigger to run `on: pull_request` in my fork and test if the workflow is working on this PR.', 'score': 0.018976133316755295, 'timestamp': '2023-09-26T16:44:52Z', 'file_name': 'pr_66.csv'}, {'message': 'Closing this PR to make more tests locally.', 'score': -0.037589156068861485, 'timestamp': '2023-09-26T17:54:41Z', 'file_name': 'pr_66.csv'}, {'message': ""### Describe the Feature\n\nA Security Policy should provide clear guidance on how to report potential vulnerabilities and inform the vulnerabilities disclosure window for this repo. It recommended by [Github](https://docs.github.com/en/code-security/getting-started/securing-your-repository#setting-a-security-policy) and [Scorecard](https://github.com/ossf/scorecard).\n\n\n### Expected Complications\n\nNo.\n\n### Will I try to implement this new feature?\n\nYes\n\n#### Additional context\nI'm Gabriela and I work on behalf of Google and the OpenSSF suggesting supply-chain security changes :)\n\nIf you agree, I can open a PR to suggest a Security Policy, and we can work together to communicate how the repo can best handle vulnerability reports."", 'score': 0.0032255398109555244, 'timestamp': '2023-04-04T20:05:54Z', 'file_name': 'issue_46.csv'}, {'message': ""## Pull request checklist\n\nPlease check if your PR fulfills the following requirements:\n- [ ] Tests for the changes have been added (for bug fixes / features)\n- [x] Docs have been reviewed and added / updated if needed (for bug fixes / features)\n- [ ] Build was run locally and without warnings or errors\n- [ ] All previous and new tests pass\n\n\n## Pull request type\n\n<!-- Please try to limit your pull request to one type, submit multiple\npull requests if needed. --> \n\nPlease check the type of change your PR introduces:\n- [ ] Bugfix\n- [x] Feature\n- [ ] Code style update (formatting, renaming, typo fix)\n- [ ] Refactoring (no functional changes, no api changes)\n- [ ] Build related changes\n- [x] Documentation content changes\n- [ ] Other (please describe): \n\n\n## What is the current behavior?\n<!-- Please describe the current behavior that you are modifying. -->\nNot having a Security Policy file.\n\n<!-- Related issue this PR addresses, if applicable -->\nRelated Issue URL: Resolves https://github.com/tukaani-project/xz/issues/46\n\n\n## What is the new behavior?\n<!-- Please describe the behavior or changes that are being added by this\nPR. -->\n- Add Security Policy file\n\n## Does this introduce a breaking change?\n\n- [ ] Yes\n- [x] No\n\n<!-- If this introduces a breaking change, please describe the impact and\nmigration path for existing applications below. -->\n\n\n## Other information\n\n<!-- Any other information that is important to this PR. -->\nI've tried to keep the timelines of confirming a vulnerability report and fixing a vulnerability as open as possible. Let me know what you think and if this seems reasonable for maintainence."", 'score': -0.002069145441055298, 'timestamp': '2023-04-05T17:09:54Z', 'file_name': 'pr_47.csv'}]","[{'message': '## Other information\n`windows-ci` is failing in my fork. I tested it on the [last commit it was working](https://github.com/tukaani-project/xz/commit/bf65f25ac8fa8b6686459c004759d8b77ba17502) without changes and it failed too, maybe it needs some data only the original repository has?', 'score': -0.848279703175649, 'timestamp': '2023-09-26T16:43:08Z', 'file_name': 'pr_66.csv'}, {'message': 'I think the failure is not related to the PR changes, can you confirm by running the workflow on the repository?', 'score': -0.4705396182835102, 'timestamp': '2023-09-26T17:27:47Z', 'file_name': 'pr_66.csv'}]"
hansjans162,hansjans162,"[{'message': 'The ifunc attribute is a cleaner and marginally more performant\nmechanism for dynamically choosing a routine at runtime.\n\nThe PR contains two parts:\n1. The first replaces the crc64 construct with the ifunc resolver.\n2. The second modifies the build process to account for the ifunc attribute.\n\nHAVE_FUNC_ATTRIBUTE_IFUNC is set if ifuncs can be built\non the system. glibc has supported ifunc since version 2.11 (2009). Building for older machines\nmay want to manually disable ifunc support when building.\n--disable-ifunc can be used with autotools and\nUSE_ATTR_IFUNC=OFF can be used with CMake to disable the check for ifunc support.\nUSE_ATTR_IFUNC defaults to ON for CMake and enable_ifunc defaults to yes for autotools.\n\nMore about ifuncs can be read [here](https://sourceware.org/glibc/wiki/GNU_IFUNC) or [here](https://www.agner.org/optimize/optimizing_cpp.pdf#page=142).\n\n\n## Pull request checklist\n\nPlease check if your PR fulfills the following requirements:\n- [ ] Tests for the changes have been added (for bug fixes / features)\n- [ ] Docs have been reviewed and added / updated if needed (for bug fixes / features)\n- [X] Build was run locally and without warnings or errors\n- [X] All previous and new tests pass\n\n\n## Pull request type\n\nPlease check the type of change your PR introduces:\n- [ ] Bugfix\n- [ ] Feature\n- [ ] Code style update (formatting, renaming, typo fix)\n- [X] Refactoring (no functional changes, no api changes)\n- [X] Build related changes\n- [ ] Documentation content changes\n- [ ] Other (please describe): \n\n\n## What is the current behavior?\ncrc64\\_fast currently uses the \\_\\_attribute\\_\\_ constructor to choose the crc implementation to use.\n\n\n## What is the new behavior?\nI replaced the \\_\\_attribute\\_\\_((\\_\\_constructor\\_\\_)) with \\_\\_attribute\\_\\_((ifunc())) in crc64_fast.c\n\n- The HAVE_FUNC_ATTRIBUTE_IFUNC flag was added to configure.ac\n- The USE_ATTR_IFUNC cmake option was added to CMakeLists.txt\n\n## Does this introduce a breaking change?\n\n- [ ] Yes\n- [X] No\n\nFunctionality should be identical.\n\n\n## Other information\n\n<!-- Any other information that is important to this PR. -->', 'score': 0.2445213100872934, 'timestamp': '2023-06-23T10:23:07Z', 'file_name': 'pr_53.csv'}]","[{'message': ""Added an implementation for crc32 that makes use of clmul.\nCode for this implementation was written by Ilya Kurdyukov and can be found here.\nhttps://github.com/ilyakurdyukov/crc-clmul-sim\n\nAlso refactored crc64_clmul to use the new macros created for crc32_clmul.\nAs well as moved similar functions to crc_clmul_common to eliminate duplicate code.\n\nI tested this on files doubling in size starting from 1 byte up to 1 Gigabyte.\nDuring testing I found that crc32_clmul can run up to 70% faster than crc32_generic,\nand has an average speed increase of 58.4% for sizes greater than 16 bytes.\n\nI also used this to test the reworked version of crc64_clmul.\nThis version of crc64_clmul is an average of 3.9% faster than the original implementation.\nThis speed increase is due to some inline assembly as well as changing around the order of some if statements. \n\n\n## Pull request checklist\n\nPlease check if your PR fulfills the following requirements:\n- [ ] Tests for the changes have been added (for bug fixes / features)\n- [ ] Docs have been reviewed and added / updated if needed (for bug fixes / features)\n- [X] Build was run locally and without warnings or errors\n- [X] All previous and new tests pass\n\n\n## Pull request type\n\n<!-- Please try to limit your pull request to one type, submit multiple\npull requests if needed. --> \n\nPlease check the type of change your PR introduces:\n- [ ] Bugfix\n- [X] Feature\n- [ ] Code style update (formatting, renaming, typo fix)\n- [X] Refactoring (no functional changes, no api changes)\n- [ ] Build related changes\n- [ ] Documentation content changes\n- [ ] Other (please describe): \n\n\n## What is the current behavior?\ncrc32\\_fast currently only uses a generic implementation.\n\n\n## What is the new behavior?\nI added an implementation for crc32 that makes use of clmul in crc32_fast.c \nAlso refactored crc64_clmul implementation to use the same macros as crc32_clmul\n\n\n## Does this introduce a breaking change?\n\n- [ ] Yes\n- [X] No\n\n\n## Other information\n\nHere is the output from both tests that gave me the statistics above.\n\nthe number of unique files tested on and the number of times the crc is run\ndecrease as the bytes get larger so the benchmark does not take too long.\n\nThe 64 and 32 spd+ show the percentage speed increase over the generic.\nThe percentage on the graph show the combined average for all types.\nFor example (50% is twice as fast, 200% is twice as slow)\n```\n64 generic: #\t\t64 clmul: +\n32 generic: =\t\t32 clmul: *\n\n#bytes, #files,   #crc's,  64spd+,  32spd+: 0%          50%          100%        150%         200%\n    16,  30000, 20648881,  39.96%,  24.24%: |           |      +*    | =    #    |            |\n    32,  30000, 12782640,  55.79%,  36.26%: |           |   +*       |  =        #            |\n    64,  30000,  7255012,  72.19%,  50.27%: |           +*           | =         |       #    |\n   128,  30000,  3890368,  82.53%,  69.13%: |       +*  |            |    =      |            |#\n   256,  30000,  2018311,  82.19%,  68.21%: |        +  |            |   =       |            |#\n   512,  30000,  1028488,  79.37%,  63.75%: |         + |            |  =        |            #\n    1K,  30000,   519217,  78.11%,  62.22%: |         + |            |   =       |           #|\n    2K,  30000,   260870,  76.74%,  61.71%: |          +|            |  =        |          # |\n    4K,  30000,   130752,  76.78%,  60.15%: |          +|            |  =        |          # |\n    8K,  30000,    65456,  76.24%,  60.59%: |          +|            |  =        |          # |\n   16K,  30000,    32748,  76.66%,  60.03%: |          +|            |  =        |          # |\n   32K,  30000,    16379,  76.78%,  60.04%: |          +|            |  =        |          # |\n   64K,  16384,     8190,  76.62%,  59.76%: |          +|            |  =        |          # |\n  128K,   8192,     4095,  76.52%,  59.71%: |          +|            |  =        |          # |\n  256K,   4096,     2047,  76.32%,  59.78%: |          +|            |  =        |          # |\n  512K,   2048,     1023,  84.70%,  60.09%: |        +  |         =  |           |            |       #\n    1M,   1024,      511,  76.71%,  60.29%: |          +|            |  =        |          # |\n    2M,    512,      255,  76.47%,  59.96%: |          +|            |  =        |          # |\n    4M,    256,      127,  76.42%,  60.03%: |          +|            |  =        |          # |\n    8M,    128,       63,  76.33%,  60.22%: |          +|            |  =        |          # |\n   16M,     64,       31,  76.55%,  60.23%: |          +|            |  =        |          # |\n   32M,     32,       15,  76.14%,  60.66%: |          +|            |  =        |          # |\n   64M,     16,       10,  76.53%,  59.99%: |          +|            |  =        |          # |\n  128M,      8,       10,  76.27%,  60.28%: |          +|            |  =        |          # |\n  256M,      4,       10,  76.42%,  59.96%: |          +|            |  =        |          # |\n  512M,      2,       10,  76.45%,  60.23%: |          +|            |  =        |          # |\n    1G,      1,       10,  76.64%,  60.19%: |          +|            |  =        |          # |\ntotal average:             75.13%,  58.44%\n\n```\n\n\nThe 64old and 64new spd+ show the percentage speed increase over the generic.\nThe percentage on the graph show the combined average for all types.\n```\n64 generic: #     64 clmul old: +     64 clmul new: *\n\n#bytes, #files,   #crc's, old64spd+, new64spd+: 0%          50%          100%        150%         200%\n     1,  30000, 48806446,  -97.328%,  -88.708%, |           | #          | * +       |            |\n     2,  30000, 44739242,  -57.943%,  -48.621%, |           |     #      |* +        |            |\n     4,  30000, 38347922,   -9.964%,   -4.811%, |           |          #*|+          |            |\n     8,  30000, 29826161,   -0.558%,    3.477%, |           |           *+           |            |\n    16,  30000, 20648881,   39.017%,   41.582%, |           |        +   |         # |            |\n    32,  30000, 12782640,   54.057%,   54.848%, |           |      +     |           |    #       |\n    64,  30000,  7255012,   69.551%,   70.777%, |           |  *+        |           |            | #\n   128,  30000,  3890368,   81.047%,   81.603%, |          *+            |           |            |            #\n   256,  30000,  2018311,   81.129%,   81.619%, |          +|            |           |            |           #\n   512,  30000,  1028488,   77.798%,   79.257%, |           *+           |           |            |         #\n    1K,  30000,   519217,   75.448%,   77.138%, |           |*+          |           |            |       #\n    2K,  30000,   260870,   73.763%,   75.518%, |           |*+          |           |            |     #\n    4K,  30000,   130752,   73.392%,   75.773%, |           |* +         |           |            |     #\n    8K,  30000,    65456,   74.341%,   76.026%, |           |*+          |           |            |      #\n   16K,  30000,    32748,   68.951%,   70.712%, |           |  *+        |           |            | #\n   32K,  30000,    16379,   73.761%,   76.129%, |           |*+          |           |            |      #\n   64K,  16384,     8190,   74.789%,   76.561%, |           |*+          |           |            |      #\n  128K,   8192,     4095,   74.834%,   75.900%, |           |*+          |           |            |      #\n  256K,   4096,     2047,   74.508%,   76.488%, |           |*+          |           |            |      #\n  512K,   2048,     1023,   74.781%,   75.998%, |           |*+          |           |            |      #\n    1M,   1024,      511,   74.523%,   76.610%, |           |*+          |           |            |      #\n    2M,    512,      255,   74.871%,   76.690%, |           |*+          |           |            |      #\n    4M,    256,      127,   74.656%,   76.658%, |           |*+          |           |            |      #\n    8M,    128,       63,   74.151%,   76.085%, |           |*+          |           |            |      #\n   16M,     64,       31,   74.802%,   76.263%, |           |*+          |           |            |      #\n   32M,     32,       15,   74.671%,   76.244%, |           |*+          |           |            |      #\n   64M,     16,       10,   74.626%,   76.459%, |           |*+          |           |            |      #\n  128M,      8,       10,   74.738%,   76.497%, |           |*+          |           |            |      #\n  256M,      4,       10,   74.395%,   76.110%, |           |*+          |           |            |      #\n  512M,      2,       10,   74.904%,   76.549%, |           |*+          |           |            |      #\n    1G,      1,       10,   74.709%,   76.477%, |           |*+          |           |            |      #\ntotal average:              57.949%,   60.255%, \nspeed increase new vs old:  3.979%\n```"", 'score': 0.07758337957784534, 'timestamp': '2023-09-25T19:53:53Z', 'file_name': 'pr_64.csv'}]",[]
DimitriPapadopoulos,DimitriPapadopoulos,[],"[{'message': '## Pull request checklist\n\nPlease check if your PR fulfills the following requirements:\n- [ ] Tests for the changes have been added (for bug fixes / features)\n- [x] Docs have been reviewed and added / updated if needed (for bug fixes / features)\n- [x] Build was run locally and without warnings or errors\n- [x] All previous and new tests pass\n\n\n## Pull request type\n\n<!-- Please try to limit your pull request to one type, submit multiple\npull requests if needed. --> \n\nPlease check the type of change your PR introduces:\n- [ ] Bugfix\n- [ ] Feature\n- [ ] Code style update (formatting, renaming, typo fix)\n- [ ] Refactoring (no functional changes, no api changes)\n- [ ] Build related changes\n- [x] Documentation content changes\n- [ ] Other (please describe): \n\n\n## What is the current behavior?\n\nTypos.\n\n## What is the new behavior?\n\nFixed typos.\n\n## Does this introduce a breaking change?\n\n- [ ] Yes\n- [x] No\n\n<!-- If this introduces a breaking change, please describe the impact and\nmigration path for existing applications below. -->\n\n\n## Other information\n\n<!-- Any other information that is important to this PR. -->', 'score': -0.0007855268195271492, 'timestamp': '2023-07-29T11:18:45Z', 'file_name': 'pr_58.csv'}]",[]
Jamaika1,Jamaika1,[],"[{'message': ""```\nmythread.h:381:48: error: 'once' undeclared (first use in this function); did you mean 'once_'?\n  381 |                         if (!InitOnceComplete(&once, 0, NULL)) \\\n      |                                                ^~~~\ncrc64_small.c:47:9: note: in expansion of macro 'mythread_once'\n   47 |         mythread_once(crc64_init);\n      |         ^~~~~~~~~~~~~\n```\n\n## Pull request checklist\n\nPlease check if your PR fulfills the following requirements:\n- [ ] Tests for the changes have been added (for bug fixes / features)\n- [ ] Docs have been reviewed and added / updated if needed (for bug fixes / features)\n- [ ] Build was run locally and without warnings or errors\n- [ ] All previous and new tests pass\n\n\n## Pull request type\n\n<!-- Please try to limit your pull request to one type, submit multiple\npull requests if needed. --> \n\nPlease check the type of change your PR introduces:\n- [ ] Bugfix\n- [ ] Feature\n- [ ] Code style update (formatting, renaming, typo fix)\n- [ ] Refactoring (no functional changes, no api changes)\n- [ ] Build related changes\n- [ ] Documentation content changes\n- [ ] Other (please describe): \n\n\n## What is the current behavior?\n<!-- Please describe the current behavior that you are modifying. -->\n\n\n<!-- Related issue this PR addresses, if applicable -->\nRelated Issue URL: \n\n\n## What is the new behavior?\n<!-- Please describe the behavior or changes that are being added by this\nPR. -->\n\n-\n-\n-\n\n## Does this introduce a breaking change?\n\n- [ ] Yes\n- [ ] No\n\n<!-- If this introduces a breaking change, please describe the impact and\nmigration path for existing applications below. -->\n\n\n## Other information\n\n<!-- Any other information that is important to this PR. -->"", 'score': -0.004106865264475346, 'timestamp': '2023-08-06T07:04:38Z', 'file_name': 'pr_59.csv'}]",[]
