from,to,positive,neutral,negative
parheliamm,parheliamm,"[{'message': 'The CRC32 instructions in ARM64 can calculate the CRC32 result for 8 bytes in a single operation, making the use of ARM64 instructions much faster compared to the general CRC32 algorithm.\n\nOptimized CRC32 will be enabled if ARM64 has CRC extension running on Linux.\n\n## Pull request checklist\n\nPlease check if your PR fulfills the following requirements:\n\n- [ ] Tests for the changes have been added (for bug fixes / features)\n- [ ] Docs have been reviewed and added / updated if needed (for bug fixes / features)\n- [x] Build was run locally and without warnings or errors\n- [ ] All previous and new tests pass\n\n\n## Pull request type\n\n<!-- Please try to limit your pull request to one type, submit multiple\npull requests if needed. --> \n\nPlease check the type of change your PR introduces:\n\n- [ ] Bugfix\n- [x] Feature\n- [ ] Code style update (formatting, renaming, typo fix)\n- [ ] Refactoring (no functional changes, no api changes)\n- [ ] Build related changes\n- [ ] Documentation content changes\n- [ ] Other (please describe): \n\n\n## What is the current behavior?\n\n<!-- Please describe the current behavior that you are modifying. -->\n\n\n<!-- Related issue this PR addresses, if applicable -->\nRelated Issue URL: \n\n\n## What is the new behavior?\n\n<!-- Please describe the behavior or changes that are being added by this\nPR. -->\n\n- Enable optimized CRC32 algorithm if ARM64 support CRC extension.\n  -\n  -\n\n## Does this introduce a breaking change?\n\n- [ ] Yes\n- [ ] No\n\n<!-- If this introduces a breaking change, please describe the impact and\nmigration path for existing applications below. -->\n\n\n## Other information\n\nBenchmark data will be updated soon', 'score': 0.40513849747367203, 'timestamp': '2024-01-09T09:38:00Z', 'file_name': 'pr_77.csv'}]","[{'message': '## Pull request checklist\n\nPlease check if your PR fulfills the following requirements:\n\n- [ ] Tests for the changes have been added (for bug fixes / features)\n- [ ] Docs have been reviewed and added / updated if needed (for bug fixes / features)\n- [x] Build was run locally and without warnings or errors\n- [x] All previous and new tests pass\n\n\n## Pull request type\n\n<!-- Please try to limit your pull request to one type, submit multiple\npull requests if needed. --> \n\nPlease check the type of change your PR introduces:\n\n- [ ] Bugfix\n- [ ] Feature\n- [ ] Code style update (formatting, renaming, typo fix)\n- [ ] Refactoring (no functional changes, no api changes)\n- [x] Build related changes\n- [ ] Documentation content changes\n- [x] Other (please describe): \n\n\n## What is the current behavior?\n\n<!-- Please describe the current behavior that you are modifying. -->\n\n\n<!-- Related issue this PR addresses, if applicable -->\nRelated Issue URL: \n\n\n## What is the new behavior?\n\n<!-- Please describe the behavior or changes that are being added by this\nPR. -->\n\n- Change LZMA_MEMCMPLEN_EXTRA to 8 on ARM64\n- select enable-unsafe-type-punning if enable_unaligned_access enabled\n  -\n\n## Does this introduce a breaking change?\n\n- [ ] Yes\n- [ ] No\n\n<!-- If this introduces a breaking change, please describe the impact and\nmigration path for existing applications below. -->\n\n\n## Other information\n\n<!-- Any other information that is important to this PR. -->\n\nPerformance improvements on ARM64 with 2 commits:\n\n    vanilla:\n    Compressor name         Compress. Decompress. Compr. size  Ratio Filename\n    memcpy                   5102 MB/s  5183 MB/s   211957760 100.00 silesia.tar\n    xz 5.2.5 -0              15.9 MB/s  51.6 MB/s    62579868  29.52 silesia.tar\n    xz 5.2.5 -1              11.8 MB/s  57.5 MB/s    58408297  27.56 silesia.tar\n    xz 5.2.5 -2              7.53 MB/s  59.9 MB/s    56708167  26.75 silesia.tar\n    xz 5.2.5 -3              5.02 MB/s  61.6 MB/s    55745576  26.30 silesia.tar\n    xz 5.2.5 -4              3.15 MB/s  62.7 MB/s    52106950  24.58 silesia.tar\n    xz 5.2.5 -5              2.29 MB/s  65.1 MB/s    49960648  23.57 silesia.tar\n    xz 5.2.5 -6              1.94 MB/s  65.5 MB/s    49196155  23.21 silesia.tar\n    xz 5.2.5 -7              1.83 MB/s  65.7 MB/s    48926731  23.08 silesia.tar\n    xz 5.2.5 -8              1.87 MB/s  66.4 MB/s    48768992  23.01 silesia.tar\n    xz 5.2.5 -9              1.85 MB/s  66.5 MB/s    48747544  23.00 silesia.tar\n\n\n\nPatched:\n\n```\nCompressor name         Compress. Decompress. Compr. size  Ratio Filename\nmemcpy                   5209 MB/s  5265 MB/s   211957760 100.00 silesia.tar\nxz 5.2.5 -0              16.4 MB/s  51.9 MB/s    62579868  29.52 silesia.tar\nxz 5.2.5 -1              12.0 MB/s  57.8 MB/s    58408297  27.56 silesia.tar\nxz 5.2.5 -2              8.26 MB/s  60.2 MB/s    56708167  26.75 silesia.tar\nxz 5.2.5 -3              5.14 MB/s  61.6 MB/s    55745576  26.30 silesia.tar\nxz 5.2.5 -4              3.29 MB/s  62.7 MB/s    52106950  24.58 silesia.tar\nxz 5.2.5 -5              2.42 MB/s  64.9 MB/s    49960648  23.57 silesia.tar\nxz 5.2.5 -6              2.03 MB/s  65.6 MB/s    49196155  23.21 silesia.tar\nxz 5.2.5 -7              1.93 MB/s  65.6 MB/s    48926731  23.08 silesia.tar\nxz 5.2.5 -8              1.94 MB/s  66.3 MB/s    48768992  23.01 silesia.tar\nxz 5.2.5 -9              1.91 MB/s  66.4 MB/s    48747544  23.00 silesia.tar\ndone... (cIters=1 dIters=1 cTime=1.0 dTime=2.0 chunkSize=1706MB cSpeed=0MB)\n```\n', 'score': -0.002281234599649906, 'timestamp': '2023-12-19T01:29:31Z', 'file_name': 'pr_75.csv'}]",[]
JiaT75,JiaT75,"[{'message': 'We will still need to have a few updates for the documentation before it is ready to be published on the website, but I am still working through them. It better to break these PRs up to make it a bit more manageable. I figured this was a good start.', 'score': 0.20869092270731926, 'timestamp': '2022-12-20T14:08:52Z', 'file_name': 'pr_4.csv'}, {'message': 'Created two PRs for this, but only one should be used. The better choice is probably https://github.com/tukaani-project/xz/pull/25, but I wanted to show both solutions to see which one we like better.', 'score': 0.2785336417146027, 'timestamp': '2023-01-26T12:49:47Z', 'file_name': 'issue_24.csv'}]","[{'message': '## Pull request checklist\n\nPlease check if your PR fulfills the following requirements:\n- [X] Tests for the changes have been added (for bug fixes / features)\n- [ ] Docs have been reviewed and added / updated if needed (for bug fixes / features)\n- [ ] Build was run locally and without warnings or errors\n- [X] All previous and new tests pass\n\n\n## Pull request type\n\n<!-- Please try to limit your pull request to one type, submit multiple\npull requests if needed. --> \n\nPlease check the type of change your PR introduces:\n- [ ] Bugfix\n- [ ] Feature\n- [ ] Code style update (formatting, renaming, typo fix)\n- [ ] Refactoring (no functional changes, no api changes)\n- [ ] Build related changes\n- [ ] Documentation content changes\n- [X] Other (please describe): New test\n\n\n## What is the current behavior?\n<!-- Please describe the current behavior that you are modifying. -->\n\n\n<!-- Related issue this PR addresses, if applicable -->\nRelated Issue URL: \n\n\n## What is the new behavior?\n<!-- Please describe the behavior or changes that are being added by this\nPR. -->\n- New test added for index_hash API functions\n- Increased code covered by tests\n\n## Does this introduce a breaking change?\n\n- [ ] Yes\n- [X] No\n\n<!-- If this introduces a breaking change, please describe the impact and\nmigration path for existing applications below. -->\n\n\n## Other information\n\n<!-- Any other information that is important to this PR. -->', 'score': -0.002516472712159157, 'timestamp': '2022-12-29T13:20:58Z', 'file_name': 'pr_7.csv'}, {'message': '### Describe the bug\n\nIf --format is set to anything other than raw, xz will only print the list information, or an error (--list works only on .xz files (--format=xz or --format=auto)). When --format=raw, xz will print:\nFilter chain: --lzma2=dict=8MiB,lc=3,lp=0,pb=2,mode=normal,nice=64,mf=bt4,depth=0 [or the actual filter chain specified]\n9 MiB of memory is required. The limiter is disabled.\n--list works only on .xz files (--format=xz or --format=auto)\n\nThis is not a critical bug, but it is a small inconsistency.\n\n### Version\n\nmaster @ 8d372bd94066b1a5b05\n\n### Operating System\n\nUbuntu\n\n### Relevant log output\n\n```shell\n./src/xz/xz --format=raw --suffix=.xz --lzma2 -lvv  config.h.xz\nxz: Filter chain: --lzma2=dict=8MiB,lc=3,lp=0,pb=2,mode=normal,nice=64,mf=bt4,depth=0\nxz: 9 MiB of memory is required. The limiter is disabled.\nxz: --list works only on .xz files (--format=xz or --format=auto)\n\n-----------------------------------------------\n\n./src/xz/xz --format=lzma --suffix=.xz --lzma2 -lvv  config.h.xz\nxz: --list works only on .xz files (--format=xz or --format=auto)\n\n-----------------------------------------------\n\n./src/xz/xz --format=xz --suffix=.xz --lzma2 -lvv  config.h.xz\nconfig.h.xz (1/1)\n  Streams:            1\n  Blocks:             1\n  Compressed size:    4,044 B\n  Uncompressed size:  16.5 KiB (16,852 B)\n  Ratio:              0.240\n  Check:              CRC64\n  Stream padding:     0 B\n  Streams:\n    Stream    Blocks      CompOffset    UncompOffset        CompSize      UncompSize  Ratio  Check      Padding\n         1         1               0               0           4,044          16,852  0.240  CRC64            0\n  Blocks:\n    Stream     Block      CompOffset    UncompOffset       TotalSize      UncompSize  Ratio  Check      CheckVal          Header  Flags        CompSize    MemUsage  Filters\n         1         1              12               0           4,008          16,852  0.238  CRC64      b4fdba2a9a1834bb      12  --              3,987       9 MiB  --lzma2=dict=8MiB\n  Memory needed:      9 MiB\n  Sizes in headers:   No\n  Minimum XZ Utils version: 5.0.0\n```', 'score': -0.12538815941661596, 'timestamp': '2023-01-07T13:39:13Z', 'file_name': 'issue_14.csv'}, {'message': 'Solved by commit to master 123255b6ed15f4428b2aa92e4962015a5362f6bf', 'score': 0.11689187539741397, 'timestamp': '2023-01-16T13:37:39Z', 'file_name': 'issue_14.csv'}, {'message': '## Pull request checklist\n\nPlease check if your PR fulfills the following requirements:\n- [X] Tests for the changes have been added (for bug fixes / features)\n- [X] Docs have been reviewed and added / updated if needed (for bug fixes / features)\n- [X] Build was run locally and without warnings or errors\n- [X] All previous and new tests pass\n\n\n## Pull request type\n\n<!-- Please try to limit your pull request to one type, submit multiple\npull requests if needed. --> \n\nPlease check the type of change your PR introduces:\n- [ ] Bugfix\n- [ ] Feature\n- [ ] Code style update (formatting, renaming, typo fix)\n- [ ] Refactoring (no functional changes, no api changes)\n- [ ] Build related changes\n- [X] Documentation content changes\n- [ ] Other (please describe): \n\n\n## What is the current behavior?\n<!-- Please describe the current behavior that you are modifying. -->\nDoxygen was outdated and never used\n\n<!-- Related issue this PR addresses, if applicable -->\nRelated Issue URL: \n\n\n## What is the new behavior?\n<!-- Please describe the behavior or changes that are being added by this\nPR. -->\n\n- Doxygen will now only generate liblzma API functions documentation\n- No longer generate LaTex documentation\n- Update Doxygen from 1.4.7 to 1.8.17\n\n## Does this introduce a breaking change?\n\n- [ ] Yes\n- [X] No\n\n<!-- If this introduces a breaking change, please describe the impact and\nmigration path for existing applications below. -->\n\n\n## Other information\n\n<!-- Any other information that is important to this PR. -->', 'score': -2.523232251405716e-05, 'timestamp': '2022-12-20T13:57:34Z', 'file_name': 'pr_4.csv'}, {'message': '## Pull request checklist\n\nPlease check if your PR fulfills the following requirements:\n- [ ] Tests for the changes have been added (for bug fixes / features)\n- [ ] Docs have been reviewed and added / updated if needed (for bug fixes / features)\n- [X] Build was run locally and without warnings or errors\n- [X] All previous and new tests pass\n\n\n## Pull request type\n\n<!-- Please try to limit your pull request to one type, submit multiple\npull requests if needed. --> \n\nPlease check the type of change your PR introduces:\n- [ ] Bugfix\n- [ ] Feature\n- [ ] Code style update (formatting, renaming, typo fix)\n- [ ] Refactoring (no functional changes, no api changes)\n- [X] Build related changes\n- [X] Documentation content changes\n- [ ] Other (please describe): \n\n## What is the new behavior?\n<!-- Please describe the behavior or changes that are being added by this\nPR. -->\n- The Doxygen html docs are now included in the release tarball\n- If only the liblzma API function documentation is generated, the docs are created in /doc/liblzma\n- If all files documentation is generated, the docs are created in /doc/html\n\n## Does this introduce a breaking change?\n\n- [ ] Yes\n- [X] No\n\n## Other information\nPutting the docs in liblzma folder may be unnecessary. Other distributions seems to place their html documentation files in a directory called ""html"" in the doc directory. If we just want to include it in the ""html"" directory in /doc, then the first and third commit can be omitted.', 'score': -0.0023099370300769806, 'timestamp': '2023-02-04T13:14:21Z', 'file_name': 'pr_30.csv'}, {'message': '## Pull request checklist\n\nPlease check if your PR fulfills the following requirements:\n- [X] Tests for the changes have been added (for bug fixes / features)\n- [X] Docs have been reviewed and added / updated if needed (for bug fixes / features)\n- [X] Build was run locally and without warnings or errors\n- [X] All previous and new tests pass\n\n\n## Pull request type\n\n<!-- Please try to limit your pull request to one type, submit multiple\npull requests if needed. --> \n\nPlease check the type of change your PR introduces:\n- [ ] Bugfix\n- [X] Feature\n- [ ] Code style update (formatting, renaming, typo fix)\n- [ ] Refactoring (no functional changes, no api changes)\n- [ ] Build related changes\n- [x] Documentation content changes\n- [ ] Other (please describe): \n\n\n## What is the current behavior?\n<!-- Please describe the current behavior that you are modifying. -->\nThe -r, --recursive option was commented out in the code as a placeholder.\n\n<!-- Related issue this PR addresses, if applicable -->\nRelated Issue URL: \n\n\n## What is the new behavior?\n<!-- Please describe the behavior or changes that are being added by this\nPR. -->\n- tuklib_list.h header file only linked list implementation was added\n- All filename reading now uses tuklib_list instead of a string array\n- XZ now supports -r, --recursive option to traverse directories\n\n## Does this introduce a breaking change?\n\n- [ ] Yes\n- [X] No\n\n<!-- If this introduces a breaking change, please describe the impact and\nmigration path for existing applications below. -->\n\n\n## Other information\n\n<!-- Any other information that is important to this PR. -->', 'score': -2.523232251405716e-05, 'timestamp': '2023-01-20T13:29:02Z', 'file_name': 'pr_22.csv'}, {'message': '### Describe the Feature\n\nBoth MinGw and CMake Windows builds should be tested.\n\n### Expected Complications\n\nDownloading the correct build environment dependencies could be tricky. GitHub might have some reusable components to help with this.\n\n### Will I try to implement this new feature?\n\nYes', 'score': -0.022351935505867004, 'timestamp': '2023-01-12T16:27:27Z', 'file_name': 'issue_18.csv'}]","[{'message': ""Turns out the error is with clang and -Wformat-nonliteral. clang treats this warning differently than gcc, which allows using a non-literal format string if the function takes its format arguments as a va_list. \n\nUnfortunately, MacOS seems to ship with gcc that really just runs clang. So this makes it harder to detect when MacOS is actually using clang.\n\nA few solutions: \n- Reduce -Wformat=2 to -Wformat=1\n- Add -Wno-format-literal\n- Add a check for CC=clang and for MacOS to set -Wno-format-literal. We can't just check CC for clang since with MacOS you can't be sure. We also can't just check $GCC=yes, since even if CC is overridden to use clang this will still be set."", 'score': -0.7271829852834344, 'timestamp': '2023-01-11T12:19:36Z', 'file_name': 'issue_16.csv'}, {'message': 'This includes the doxygen .html files in the release, but does not install them. I will need to rework this to actually install the files, which seems more useful than just including them.', 'score': -0.47057575173676014, 'timestamp': '2023-02-15T12:13:05Z', 'file_name': 'pr_30.csv'}, {'message': ""Now I have the HTML files being installed. They are currently installed to `$(docdir)/liblzma`, for liblzma headers only, or `$(docdir)/html` for full documentation. So, by default, it will install to `/share/doc/xz/liblzma`, which I am not sure if I like.\n\nI don't know of a good clean way to install to `/share/doc/liblzma` (or  `/share/doc/liblzma/html` if that makes more sense) since `$(docdir)` is `/share/doc/xz`. We can always install to `$(docdir)/../liblzma`, but that is hacky. If there is a good clean way to do this, I might be interested to try it.\n\nIf we don't like how it is now, the easiest alternative is to always install to `/share/doc/xz/html` and not care about the distinction between liblzma header only documentation and all source files documentation. "", 'score': -0.4261406799778342, 'timestamp': '2023-02-16T14:31:59Z', 'file_name': 'pr_30.csv'}, {'message': '### Describe the bug\n\nNot necessarily a bug, but the behavior is confusing. lzma_str_to_filters() is successful with the filter string ""lzma1"" when LZMA_STR_ALL_FILTERS flag is used, as expected. However, lzma_str_to_filters() fails with ""lzma1"" when LZMA_STR_NO_VALIDATION. This is confusing because the ""validation"" is too vague. Checking if a filter can be used with the .xz format is technically validation. So, either the code should change or the documentation should be updated to clarify this.\n\n### Version\n\n5.4.1\n\n### Operating System\n\nUbuntu\n\n### Relevant log output\n\n_No response_', 'score': -0.9271229326259345, 'timestamp': '2023-01-24T13:08:41Z', 'file_name': 'issue_24.csv'}]"
kianmeng,kianmeng,[],"[{'message': '## Pull request checklist\n\nPlease check if your PR fulfills the following requirements:\n- [ ] Tests for the changes have been added (for bug fixes / features)\n- [ ] Docs have been reviewed and added / updated if needed (for bug fixes / features)\n- [ ] Build was run locally and without warnings or errors\n- [ ] All previous and new tests pass\n\n\n## Pull request type\n\n<!-- Please try to limit your pull request to one type, submit multiple\npull requests if needed. --> \n\nPlease check the type of change your PR introduces:\n- [ ] Bugfix\n- [ ] Feature\n- [ ] Code style update (formatting, renaming, typo fix)\n- [ ] Refactoring (no functional changes, no api changes)\n- [ ] Build related changes\n- [x] Documentation content changes\n- [ ] Other (please describe): \n\n\n## What is the current behavior?\n<!-- Please describe the current behavior that you are modifying. -->\nTypos fixes of `codespell`.\n\n<!-- Related issue this PR addresses, if applicable -->\nRelated Issue URL: \n\n\n## What is the new behavior?\n<!-- Please describe the behavior or changes that are being added by this\nPR. -->\n- Found new typos via `typos --hidden --format brief`\n-\n-\n\n## Does this introduce a breaking change?\n\n- [ ] Yes\n- [x] No\n\n<!-- If this introduces a breaking change, please describe the impact and\nmigration path for existing applications below. -->\n\n\n## Other information\n\n<!-- Any other information that is important to this PR. -->', 'score': -0.0019700713455677032, 'timestamp': '2023-11-30T13:47:26Z', 'file_name': 'pr_74.csv'}]",[]
kiyolee,kiyolee,[],"[{'message': 'To support files larger than 4 GiB on Windows, all calls of stat() and lseek() have to be redirected to 64-bit filesize capable calls.\n\n## Pull request checklist\n\nPlease check if your PR fulfills the following requirements:\n- [ ] Tests for the changes have been added (for bug fixes / features)\n- [ ] Docs have been reviewed and added / updated if needed (for bug fixes / features)\n- [X] Build was run locally and without warnings or errors\n- [X] All previous and new tests pass\n\nNote: Compile warnings are inevitable for MSVC when some variables can be either 64-bit (target x64) or 32-bit (target Win32) at compile time. Those warnings need extensive changes to clean up.\n\n## Pull request type\n\n<!-- Please try to limit your pull request to one type, submit multiple\npull requests if needed. --> \n\nPlease check the type of change your PR introduces:\n- [ ] Bugfix\n- [ ] Feature\n- [ ] Code style update (formatting, renaming, typo fix)\n- [ ] Refactoring (no functional changes, no api changes)\n- [ ] Build related changes\n- [ ] Documentation content changes\n- [X] Other (please describe): \n\nMake xz buildable with MSVC.\nAdd 64-bit filesize support on Windows.\n\n## What is the current behavior?\n<!-- Please describe the current behavior that you are modifying. -->\n\nxz does not build with MSVC.\nxz would refuse to handle files larger than 4 GiB.\n\n<!-- Related issue this PR addresses, if applicable -->\nRelated Issue URL: \n\n\n## What is the new behavior?\n<!-- Please describe the behavior or changes that are being added by this\nPR. -->\n\nxz can be built with MSVC.\nxz can handle files larger than 4 GiB on Windows.\n\n\n## Does this introduce a breaking change?\n\n- [ ] Yes\n- [X] No\n\n<!-- If this introduces a breaking change, please describe the impact and\nmigration path for existing applications below. -->\n\n\n## Other information\n\n<!-- Any other information that is important to this PR. -->\n\nI have added extensive MSVC build support in my own repo https://github.com/kiyolee/xz-win-build.\nIn addition to building xz, I have added support to build all tests as well.\nThis PR only covers code changes that were done while setting up my own repo.', 'score': 0.002956356853246689, 'timestamp': '2023-08-26T00:21:40Z', 'file_name': 'pr_60.csv'}, {'message': '## Pull request checklist\n\nPlease check if your PR fulfills the following requirements:\n- [ ] Tests for the changes have been added (for bug fixes / features)\n- [ ] Docs have been reviewed and added / updated if needed (for bug fixes / features)\n- [X] Build was run locally and without warnings or errors\n- [X] All previous and new tests pass\n\n\n## Pull request type\n\n<!-- Please try to limit your pull request to one type, submit multiple\npull requests if needed. --> \n\nPlease check the type of change your PR introduces:\n- [ ] Bugfix\n- [ ] Feature\n- [ ] Code style update (formatting, renaming, typo fix)\n- [ ] Refactoring (no functional changes, no api changes)\n- [X] Build related changes\n- [ ] Documentation content changes\n- [ ] Other (please describe): \n\n\n## What is the current behavior?\n<!-- Please describe the current behavior that you are modifying. -->\n\ncmake build with MSVC failed as ""getopt.in.h"" included <unistd.h> which does not exist for MSVC.\n\n<!-- Related issue this PR addresses, if applicable -->\nRelated Issue URL: \n\n\n## What is the new behavior?\n<!-- Please describe the behavior or changes that are being added by this\nPR. -->\n\ncmake build with MSVC succeeded.\n\n## Does this introduce a breaking change?\n\n- [ ] Yes\n- [X] No\n\n<!-- If this introduces a breaking change, please describe the impact and\nmigration path for existing applications below. -->\n\n\n## Other information\n\n<!-- Any other information that is important to this PR. -->', 'score': -0.0023099370300769806, 'timestamp': '2023-09-15T21:06:09Z', 'file_name': 'pr_63.csv'}, {'message': 'Would you consider renaming ""getopt.in.h"" to ""getopt.h""?\nThere is nothing in ""getopt.in.h"" that needs to be generated.\nThe generated ""getopt.h"" by cmake build is exactly the same as ""getopt.in.h"".', 'score': -0.012956123799085617, 'timestamp': '2023-09-15T21:07:54Z', 'file_name': 'pr_63.csv'}]",[]
nullyfae,nullyfae,[],"[{'message': '### Describe the Feature\n\nAbout the backdoor report (https://www.cve.org/CVERecord?id=CVE-2024-3094), an ""easy"" fix to ensure is impossible to happen again is to rewrite xz in rust.\n\n### Expected Complications\n\n- Learning rust\n- Regain comunity trust\n- Integration with other softwares that depends on xz.\n\n### Will I try to implement this new feature?\n\nNo', 'score': -0.11017230153083801, 'timestamp': '2024-03-30T00:23:17Z', 'file_name': 'issue_102.csv'}]",[]
